name,molecule,dosage_form,date_of_approval,company,treatment_for,url_x,molecule_url,drug_class,image,related_drugs,rating,reviews,reviews_url,Availability,Pregnancy & Lactation,CSA Schedule*,Approval History,WADA Class,most_reviewed_condition,most_reviewed_rating,n_reviews,url_y
Eylea HD,aflibercept,Injection,"August 18, 2023","Regeneron Pharmaceuticals, Inc.","Macular Degeneration, Diabetic Macular Edema, Diabetic Retinopathy",https://www.drugs.com/eylea.html,https://www.drugs.com/mtm/aflibercept-ophthalmic.html,Eylea HD,https://www.drugs.com/images/pills/custom/pill33224-1/eylea.jpeg,"triamcinolone ophthalmic, dexamethasone ophthalmic, Vabysmo, Izervay, fluocinolone ophthalmic, aflibercept ophthalmic, Lucentis",7.1,61,https://www.drugs.com/comments/aflibercept-ophthalmic/eylea.html,Prescription only,Risk data available,Not a controlled drug,,,Macular Degeneration  ,7.1,34,https://www.drugs.com/comments/aflibercept-ophthalmic/eylea.html
Veozah,fezolinetant,Tablets,"May 12, 2023",Astellas Pharma Inc.,"Menopausal Disorders, Hot Flashes",https://www.drugs.com/veozah.html,https://www.drugs.com/mtm/fezolinetant.html,Miscellaneous central nervous system agents,https://www.drugs.com/images/pills/custom/pill34467-1/veozah.png,,7.8,9,https://www.drugs.com/comments/fezolinetant/veozah.html,Prescription only,Risk data available,Not a controlled drug, FDA approved 2023,,Hot Flashes  ,7.8,9,https://www.drugs.com/comments/fezolinetant/veozah.html
Paxlovid,nirmatrelvir and ritonavir,Tablets,"May 25, 2023",Pfizer Inc.,COVID-19,https://www.drugs.com/paxlovid.html,https://www.drugs.com/mtm/nirmatrelvir-and-ritonavir.html,Antiviral combinations,https://www.drugs.com/images/pills/custom/pill32282-1/paxlovid.jpg,"Lagevrio, molnupiravir, remdesivir, Actemra, nirmatrelvir / ritonavir, Olumiant",7.1,493,https://www.drugs.com/comments/nirmatrelvir-ritonavir/paxlovid.html,Prescription only,Risk data available,Not a controlled drug,,,COVID-19  ,7.1,493,https://www.drugs.com/comments/nirmatrelvir-ritonavir/paxlovid.html
Miebo,perfluorohexyloctane,Ophthalmic Solution  - formerly NOV03,"May 18, 2023",Bausch + Lomb Corporation and Novaliq,Dry Eye Disease,https://www.drugs.com/miebo.html,https://www.drugs.com/mtm/perfluorohexyloctane-ophthalmic.html,Ophthalmic anti-inflammatory agents,https://www.drugs.com/images/pills/custom/pill34471-1/miebo.jpeg,,8.8,15,https://www.drugs.com/comments/perfluorohexyloctane-ophthalmic/miebo.html,Prescription only,Risk data available,Not a controlled drug,Drug history at FDA,,Dry Eye Disease  ,8.7,14,https://www.drugs.com/comments/perfluorohexyloctane-ophthalmic/miebo.html
Zepbound,tirzepatide,Injection,"November 8, 2023",Eli Lilly and Company,Weight Loss (Obesity/Overweight),https://www.drugs.com/zepbound.html,https://www.drugs.com/tirzepatide.html,Mounjaro,https://www.drugs.com/images/pills/custom/pill35296-1/zepbound.png,"Mounjaro, semaglutide, phentermine, Wegovy, Saxenda, Alli",9.1,41,https://www.drugs.com/comments/tirzepatide/zepbound.html,Prescription only,Risk data available,Not a controlled drug,Drug history at FDA,,Weight Loss (Obesity/Overweight)  ,9.1,40,https://www.drugs.com/comments/tirzepatide/zepbound.html
Abilify Asimtufii,aripiprazole,Extended-Release Injectable Suspension,"April 27, 2023","Otsuka Pharmaceutical Co., Ltd.","Schizophrenia, Bipolar Disorder",https://www.drugs.com/abilify-asimtufii.html,https://www.drugs.com/aripiprazole.html,,,"Vraylar, quetiapine, lamotrigine, aripiprazole, Abilify, Seroquel, olanzapine",,,,Prescription only,Risk data available,Not a controlled drug,Drug history at FDA,,,,,
Abrysvo,respiratory syncytial virus vaccine,Injection,"May 31, 2023","Pfizer, Inc.",RSV,https://www.drugs.com/abrysvo.html,https://www.drugs.com/rsv-vaccine.html,Viral vaccines,https://www.drugs.com/images/pills/custom/pill35062-1.webp,"Arexvy, ribavirin, Beyfortus, Synagis, palivizumab, rsv vaccine, pref a-pref b, recombinant, nirsevimab",,,,Prescription only,Risk data available,Not a controlled drug,,,,,,
Adzynma,"ADAMTS13, recombinant-krhn",Lyophilized Powder for Injection,"November 9, 2023",Takeda,Thrombotic Thrombocytopenic Purpura,https://www.drugs.com/adzynma.html,https://www.drugs.com/mtm/apadamtase-alfa-recombinant.html,Lysosomal enzymes,,,,,,Prescription only,Risk data available,Not a controlled drug,,,,,,
Agamree,vamorolone,Oral Suspension,"October 26, 2023","Catalyst Pharmaceuticals, Inc.",Duchenne Muscular Dystrophy,https://www.drugs.com/agamree.html,https://www.drugs.com/mtm/vamorolone.html,Glucocorticoids,,"Elevidys, Viltepso, deflazacort, Emflaza, Exondys 51, vamorolone",,,,Prescription only,Risk data available,Not a controlled drug, FDA approved 2023,,,,,
Airsupra,albuterol and budesonide,Inhalation Aerosol,"January 10, 2023",AstraZeneca Pharmaceuticals LP,Asthma,https://www.drugs.com/airsupra.html,https://www.drugs.com/mtm/albuterol-and-budesonide-inhalation.html,Antiasthmatic combinations,https://www.drugs.com/images/pills/custom/pill34230-1/airsupra.png,,,,,Prescription only,Risk data available,Not a controlled drug,Drug history at FDA,Anti-Doping Classification,,,,
Akeega,abiraterone acetate and niraparib,Tablets,"August 11, 2023","Janssen Pharmaceuticals, Inc.",Prostate Cancer,https://www.drugs.com/akeega.html,https://www.drugs.com/mtm/abiraterone-and-niraparib.html,Antineoplastic combinations,,,,,,Prescription only,Risk data available,Not a controlled drug,Drug history at FDA,,,,,
Altuviiio,"antihemophilic factor recombinant, Fc-VWF-XTEN fusion protein-ehtl",Lyophilized Powder for Injection,"February 22, 2023",Sanofi,Hemophilia A,https://www.drugs.com/altuviiio.html,https://www.drugs.com/mtm/antihemophilic-factor-human.html,Miscellaneous coagulation modifiers,,"tranexamic acid, desmopressin, Hemlibra, Cyklokapron, DDAVP, antihemophilic factor",,,,Prescription only,Risk data available,Not a controlled drug,,,,,,
Alyglo,"immune globulin intravenous, human-stwk",Liquid for Intravenous Injection,"December 15, 2023","GC Biopharma USA, Inc.",Primary Immunodeficiency Syndrome,https://www.drugs.com/alyglo.html,https://www.drugs.com/mtm/immune-globulin-intravenous-igiv.html,,https://www.drugs.com/images/pills/custom/pill35662-1/alyglo.jpg,"Hizentra, Octagam, Privigen, Cuvitru, Panzyga, Gammagard Liquid",,,,Prescription only,Risk data available,Not a controlled drug,,,,,,
Aphexda,motixafortide,Lyophilized Powder for Injection,"September 8, 2023",BioLineRx Ltd.,Hematopoietic Stem Cell Mobilization,https://www.drugs.com/aphexda.html,https://www.drugs.com/mtm/motixafortide.html,Hematopoietic stem cell mobilizer,https://www.drugs.com/images/pills/custom/pill35060-1/aphexda.jpeg,"Abecma, Velcade, Revlimid, Darzalex, Pomalyst, Kyprolis, Ninlaro",,,,Prescription only,Risk data available,Not a controlled drug,Drug history at FDA,,,,,
Arexvy,"respiratory syncytial virus vaccine, adjuvanted",Suspension for Intramuscular Injection,"May 3, 2023",GlaxoSmithKline,Prevention of RSV Infection,https://www.drugs.com/arexvy.html,https://www.drugs.com/mtm/respiratory-syncytial-virus-rsv-vaccine.html,Viral vaccines,https://www.drugs.com/images/pills/custom/pill35142-1/arexvy.png,,,,,Prescription only,Risk data available,Not a controlled drug,,,,,,
Augtyro,repotrectinib,Capsules,"November 15, 2023",Bristol Myers Squibb,Non-Small Cell Lung Cancer,https://www.drugs.com/augtyro.html,https://www.drugs.com/mtm/repotrectinib.html,Multikinase inhibitors,,"Opdivo, methotrexate, Keytruda, Avastin, pembrolizumab, bevacizumab, Tagrisso",,,,Prescription only,Risk data available,Not a controlled drug, FDA approved 2023,,,,,
Avzivi,bevacizumab-tnjn,Injection,"December 6, 2023","Bio-Thera Solutions, Ltd.","Colorectal Cancer, Non-Small Cell Lung Cancer, Glioblastoma Multiforme, Renal Cell Carcinoma, Cervical Cancer, Ovarian Cancer, Fallopian Tube Cancer, Peritoneal Cancer",https://www.drugs.com/avzivi.html,https://www.drugs.com/bevacizumab.html,VEGF/VEGFR  inhibitors,,"Opdivo, methotrexate, Keytruda, Avastin, carboplatin, pembrolizumab, fluorouracil",,,,Prescription only,Risk data available,Not a controlled drug,,,,,,
Balfaxar,"prothrombin complex concentrate, human-lans",Lyophilized Powder for Injection,"July 21, 2023","Octapharma USA, Inc.",Warfarin Reversal in Urgent Surgery & Invasive Procedures,https://www.drugs.com/balfaxar.html,https://www.drugs.com/mtm/prothrombin-complex.html,Anticoagulant reversal agents,,,,,,Prescription only,Risk data available,Not a controlled drug,,,,,,
Beyfortus,nirsevimab-alip,Injection,"July 17, 2023",AstraZeneca,RSV,https://www.drugs.com/beyfortus.html,https://www.drugs.com/mtm/nirsevimab.html,Other immunostimulants,https://www.drugs.com/images/pills/custom/pill34774-1.webp,"Arexvy, Abrysvo, ribavirin, Synagis, palivizumab, rsv vaccine, pref a-pref b, recombinant, nirsevimab",,,,Prescription only,Risk data available,Not a controlled drug,Drug history at FDA,,,,,
Bimzelx,bimekizumab-bkzx,Injection,"October 17, 2023","UCB, Inc.",Plaque Psoriasis,https://www.drugs.com/bimzelx.html,https://www.drugs.com/bimekizumab.html,Interleukin inhibitors,https://www.drugs.com/images/pills/custom/pill35250-1/bimzelx.jpg,"Cimzia, Otezla, Stelara, Taltz, Remicade, Humira, Enbrel",,,,Prescription only,Risk data available,Not a controlled drug,Drug history at FDA,,,,,
Brenzavvy,bexagliflozin,Tablets,"January 20, 2023","TheracosBio, LLC","Diabetes, Type 2",https://www.drugs.com/brenzavvy.html,https://www.drugs.com/mtm/bexagliflozin.html,SGLT-2 inhibitors,https://www.drugs.com/images/pills/custom/pill33964-1/brenzavvy.jpg,"metformin, Trulicity, Lantus, Tresiba, Victoza, Levemir",,,,Prescription only,Risk data available,Not a controlled drug, FDA approved 2023,,,,,
Brixadi,buprenorphine,Extended-Release Injection,"May 23, 2023",Braeburn Inc.,Opioid Use Disorder,https://www.drugs.com/brixadi.html,https://www.drugs.com/buprenorphine.html,,https://www.drugs.com/images/pills/custom/pill34480-1/brixadi.png,"naltrexone, buprenorphine, Suboxone, buprenorphine / naloxone, Subutex, Vivitrol, Sublocade",,,,Prescription only,Risk data available,Moderate abuse potential,Drug history at FDA,Anti-Doping Classification,,,,
Cabtreo,"adapalene, benzoyl peroxide and clindamycin phosphate",Topical Gel,"October 20, 2023",Bausch Health Companies Inc.,Acne,https://www.drugs.com/cabtreo.html,https://www.drugs.com/drug-class/topical-acne-agents.html,,,"doxycycline, clindamycin topical, erythromycin topical, tetracycline, Tazorac",,,,Prescription only,,Not a controlled drug,Drug history at FDA,,,,,
Casgevy,exagamglogene autotemcel,Suspension for Intravenous Infusion,"December 8, 2023",Vertex Pharmaceuticals Incorporated and CRISPR Therapeutics,"Sickle Cell Disease, Beta Thalassemia",https://www.drugs.com/casgevy.html,https://www.drugs.com/mtm/exagamglogene-autotemcel.html,Miscellaneous uncategorized agents,,,,,,Prescription only,Risk data available,Not a controlled drug,,,,,,
Columvi,glofitamab-gxbm,Injection,"June 15, 2023",Genentech,Diffuse Large B-Cell Lymphoma,https://www.drugs.com/columvi.html,https://www.drugs.com/mtm/glofitamab.html,CD20 monoclonal antibodies,https://www.drugs.com/images/pills/custom/pill35141-1.webp,,,,,Prescription only,Risk data available,Not a controlled drug, FDA approved 2023,,,,,
Combogesic IV,acetaminophen and ibuprofen,Injection,"October 17, 2023",AFT Pharmaceuticals Ltd.,Postoperative Pain,https://www.drugs.com/combogesic-iv.html,https://www.drugs.com/mtm/acetaminophen-and-ibuprofen.html,Analgesic combinations,,"acetaminophen, tramadol, cyclobenzaprine, naproxen, oxycodone, Tylenol",,,,Prescription only,,Not a controlled drug,Drug history at FDA,,,,,
Cyfendus,"anthrax vaccine adsorbed, adjuvanted",Injection,"July 20, 2023",Emergent BioSolutions Inc.,Anthrax Prophylaxis,https://www.drugs.com/cyfendus.html,https://www.drugs.com/mtm/anthrax-vaccine.html,Bacterial vaccines,,,,,,Prescription only,Risk data available,Not a controlled drug,,,,,,
Daybue,trofinetide,Oral Solution,"March 10, 2023",Acadia Pharmaceuticals Inc.,Rett Syndrome,https://www.drugs.com/daybue.html,https://www.drugs.com/mtm/trofinetide.html,Miscellaneous central nervous system agents,https://www.drugs.com/images/pills/custom/pill34290-1/daybue.jpeg,,,,,Prescription only,Risk data available,Not a controlled drug, FDA approved 2023,,,,,
DefenCath,taurolidine and heparin,Catheter Lock Solution,"November 15, 2023",CorMedix Inc.,Prevention of Catheter-Related Bloodstream Infections,https://www.drugs.com/defencath.html,https://www.drugs.com/monograph/taurolidine-and-heparin-local.html,,,,,,,Prescription only,,,Drug history at FDA,,,,,
Elevidys,delandistrogene moxeparvovec-rokl,Suspension for Intravenous Infusion,"June 22, 2023","Sarepta Therapeutics, Inc.",Duchenne Muscular Dystrophy,https://www.drugs.com/elevidys.html,https://www.drugs.com/mtm/delandistrogene-moxeparvovec.html,Miscellaneous uncategorized agents,https://www.drugs.com/images/pills/custom/pill34861-1/elevidys.jpeg,,,,,Prescription only,Risk data available,Not a controlled drug,,,,,,
Elfabrio,pegunigalsidase alfa-iwxj,Injection,"May 9, 2023","Protalix BioTherapeutics, Inc.",Fabry Disease,https://www.drugs.com/elfabrio.html,https://www.drugs.com/mtm/pegunigalsidase-alfa.html,Lysosomal enzymes,,"Fabrazyme, Galafold, agalsidase beta",,,,Prescription only,Risk data available,Not a controlled drug, FDA approved 2023,,,,,
Elrexfio,elranatamab-bcmm,Injection,"August 14, 2023",Pfizer Inc.,Multiple Myeloma,https://www.drugs.com/elrexfio.html,https://www.drugs.com/mtm/elranatamab.html,Miscellaneous antineoplastics,https://www.drugs.com/images/pills/custom/pill35061-1/elrexfio.jpeg,,,,,Prescription only,Risk data available,Not a controlled drug, FDA approved 2023,,,,,
Epkinly,epcoritamab-bysp,Injection,"May 19, 2023",AbbVie Inc.,Diffuse Large B-Cell Lymphoma,https://www.drugs.com/epkinly.html,https://www.drugs.com/mtm/epcoritamab.html,CD20 monoclonal antibodies,https://www.drugs.com/images/pills/custom/pill34472-1/epkinly.jpg,"Rituxan, Truxima, Yescarta, Monjuvi, Kymriah, Polivy, Tazverik",,,,Prescription only,Risk data available,Not a controlled drug, FDA approved 2023,,,,,
Exxua,gepirone,Extended-Release Tablets,"September 22, 2023",Fabre-Kramer Pharmaceuticals Inc.,Major Depressive Disorder,https://www.drugs.com/exxua.html,https://www.drugs.com/cons/gepirone.html,,,"Trintellix, Vraylar, sertraline, trazodone, Lexapro, Zoloft, Wellbutrin",,,,Prescription only,,, FDA approved 2023,,,,,
Fabhalta,iptacopan,Capsules,"December 5, 2023",Novartis,Paroxysmal Nocturnal Hemoglobinuria,https://www.drugs.com/fabhalta.html,https://www.drugs.com/mtm/iptacopan.html,Selective immunosuppressants,,,,,,Prescription only,,Not a controlled drug, FDA approved 2023,,,,,
Filspari,sparsentan,Tablets,"February 17, 2023","Travere Therapeutics, Inc.",Primary Immunoglobulin A Nephropathy,https://www.drugs.com/filspari.html,https://www.drugs.com/mtm/sparsentan.html,Miscellaneous cardiovascular agents,https://www.drugs.com/images/pills/custom/pill34077-1/filspari.jpeg,,,,,Prescription only,Risk data available,Not a controlled drug, FDA approved 2023,,,,,
Filsuvez,birch triterpenes,Topical Gel  - formerly Oleogel-S10,"December 19, 2023",Chiesi Global Rare Diseases,Epidermolysis Bullosa,https://www.drugs.com/filsuvez.html,https://www.drugs.com/monograph/birch-triterpenes.html,Herbal products,https://www.drugs.com/images/pills/custom/pill35660-1/filsuvez.jpg,Vyjuvek,,,,Prescription only,Risk data available,Not a controlled drug, FDA approved 2023,,,,,
Fruzaqla,fruquintinib,Capsules,"November 8, 2023",Takeda,Colorectal Cancer,https://www.drugs.com/fruzaqla.html,https://www.drugs.com/mtm/fruquintinib.html,Multikinase inhibitors,,,,,,Prescription only,Risk data available,Not a controlled drug, FDA approved 2023,,,,,
Hepzato,melphalan,Lyophilized Powder for Injection,"August 14, 2023","Delcath Systems, Inc.",Uveal Melanoma,https://www.drugs.com/hepzato-kit.html,https://www.drugs.com/mtm/melphalan-oral-injection.html,Alkylating agents,,"melphalan, Kimmtrak, tebentafusp",,,,Prescription only,Risk data available,Not a controlled drug,Drug history at FDA,,,,,
iDose TR,travoprost,Intracameral Implant,"December 13, 2023",Glaukos Corporation,"Glaucoma, Open Angle, Glaucoma/Intraocular Hypertension",https://www.drugs.com/idose-tr.html,https://www.drugs.com/mtm/travoprost-ophthalmic.html,Ophthalmic glaucoma agents,,"epinephrine ophthalmic, latanoprost ophthalmic, timolol ophthalmic, pilocarpine ophthalmic, brimonidine ophthalmic, Lumigan, Xalatan",,,,Prescription only,Risk data available,Not a controlled drug,,,,,,
Inpefa,sotagliflozin,Tablets,"May 26, 2023","Lexicon Pharmaceuticals, Inc.",Heart Failure,https://www.drugs.com/inpefa.html,https://www.drugs.com/mtm/sotagliflozin.html,Miscellaneous cardiovascular agents,https://www.drugs.com/images/pills/custom/pill34559-1/inpefa.jpeg,"lisinopril, metoprolol, furosemide, carvedilol, spironolactone, triamcinolone",,,,Prescription only,Risk data available,Not a controlled drug, FDA approved 2023,,,,,
Iwilfin,eflornithine,Tablets,"December 13, 2023","US WorldMeds, LLC",Neuroblastoma,https://www.drugs.com/iwilfin.html,https://www.drugs.com/mtm/eflornithine.html,Miscellaneous antineoplastics,https://www.drugs.com/images/pills/custom/pill35392-1/iwilfin.jpg,,,,,Prescription only,Risk data available,Not a controlled drug,Drug history at FDA,,,,,
Ixchiq,"chikungunya vaccine, live",Injection  - formerly VLA1553,"November 9, 2023",Valneva SE,Chikungunya Disease Prevention,https://www.drugs.com/ixchiq.html,https://www.drugs.com/mtm/chikungunya-vaccine-live-cvx-317.html,Viral vaccines,,,,,,Prescription only,,Not a controlled drug,,,,,,
Izervay,avacincaptad pegol,Intravitreal Solution,"August 4, 2023","Iveric Bio, Inc.",Geographic Atrophy,https://www.drugs.com/izervay.html,https://www.drugs.com/mtm/avacincaptad-pegol-ophthalmic.html,Anti-angiogenic ophthalmic agents,https://www.drugs.com/images/pills/custom/pill34860-1/izervay.jpeg,,,,,Prescription only,Risk data available,Not a controlled drug,Drug history at FDA,,,,,
Jaypirca,pirtobrutinib,Tablets,"January 27, 2023",Eli Lilly and Company,"Mantle Cell Lymphoma, Chronic Lymphocytic Leukemia",https://www.drugs.com/jaypirca.html,https://www.drugs.com/mtm/pirtobrutinib.html,BTK inhibitors,https://www.drugs.com/images/pills/custom/pill33966-1/jaypirca.png,"Revlimid, Imbruvica, Velcade, Venclexta, rituximab, cyclophosphamide, Rituxan",,,,Prescription only,Risk data available,Not a controlled drug, FDA approved 2023,,,,,
Jesduvroq,daprodustat,Tablets,"February 1, 2023",GlaxoSmithKline,Anemia Due to Chronic Kidney Disease,https://www.drugs.com/jesduvroq.html,https://www.drugs.com/mtm/daprodustat.html,Miscellaneous uncategorized agents,https://www.drugs.com/images/pills/custom/pill33971-1/jesduvroq.png,,,,,Prescription only,Risk data available,Not a controlled drug, FDA approved 2023,Anti-Doping Classification,,,,
Joenja,leniolisib,Tablets,"March 24, 2023",Pharming Group N.V.,Activated PI3K-Delta Syndrome,https://www.drugs.com/joenja.html,https://www.drugs.com/mtm/leniolisib.html,PI3K inhibitors,,leniolisib,,,,Prescription only,Risk data available,Not a controlled drug, FDA approved 2023,,,,,
Lantidra,donislecel-jujn,Cellular Suspension for Infusion,"June 28, 2023","CellTrans, Inc.","Diabetes, Type 1",https://www.drugs.com/lantidra.html,https://www.drugs.com/monograph/donislecel-jujn.html,,,,,,,Prescription only,,,,,,,,
Leqembi,lecanemab-irmb,Injection,"January 6, 2023","Biogen Inc. and Eisai Co., Ltd.",Alzheimer's Disease,https://www.drugs.com/leqembi.html,https://www.drugs.com/mtm/lecanemab-injection.html,Miscellaneous central nervous system agents,https://www.drugs.com/images/pills/custom/pill33850-1.webp,"donepezil, memantine, Aricept, Namenda, rivastigmine, Exelon",,,,Prescription only,Risk data available,Not a controlled drug, FDA approved 2023,,,,,
Likmez,metronidazole,Oral Suspension  - formerly ATI-1501,"September 22, 2023","Appili Therapeutics Inc. and Saptalis Pharmaceuticals , LLC","Bacterial Infection, Trichomoniasis, Amebiasis",https://www.drugs.com/likmez.html,https://www.drugs.com/metronidazole.html,Amebicides,,,,,,Prescription only,Risk data available,Not a controlled drug,Drug history at FDA,,,,,
Liqrev,sildenafil citrate,Oral Suspension,"April 28, 2023","CMP Pharma, Inc.",Pulmonary Arterial Hypertension,https://www.drugs.com/liqrev.html,https://www.drugs.com/sildenafil.html,Agents for pulmonary hypertension,https://www.drugs.com/images/pills/custom/pill34684-1/liqrev.png,"sildenafil, tadalafil, Adcirca, ambrisentan, Revatio, Opsumit",,,,Prescription only,Risk data available,Not a controlled drug,Drug history at FDA,,,,,
Litfulo,ritlecitinib,Capsules,"June 23, 2023",Pfizer Inc.,Alopecia,https://www.drugs.com/litfulo.html,https://www.drugs.com/mtm/ritlecitinib.html,Multikinase inhibitors,https://www.drugs.com/images/pills/custom/pill34685-1/litfulo.jpeg,"Olumiant, triamcinolone, minoxidil topical, Kenalog-40, baricitinib, Kenalog-10",,,,Prescription only,Risk data available,Not a controlled drug, FDA approved 2023,,,,,
Lodoco,colchicine,Tablets,"June 16, 2023","AGEPHA Pharma USA, LLC",Cardiovascular Risk Reduction,https://www.drugs.com/lodoco.html,https://www.drugs.com/mtm/colchicine.html,,https://www.drugs.com/images/pills/custom/pill34673-1/lodoco.jpeg,"Repatha, Ozempic, Jardiance, simvastatin, Trulicity, Victoza, Brilinta",,,,Prescription only,Risk data available,Not a controlled drug,Drug history at FDA,,,,,
Loqtorzi,toripalimab-tpzi,Injection,"October 27, 2023","Coherus Biosciences, Inc.",Nasopharyngeal Carcinoma,https://www.drugs.com/loqtorzi.html,https://www.drugs.com/toripalimab.html,Anti-PD-1 and PD-L1 monoclonal antibodies (immune checkpoint inhibitors),,"fluorouracil, cisplatin, paclitaxel, gemcitabine, toripalimab",,,,Prescription only,Risk data available,Not a controlled drug, FDA approved 2023,,,,,
Lumryz,sodium oxybate,Granules for Extended-Release Oral Suspension,"May 1, 2023",Avadel Pharmaceuticals plc,Narcolepsy,https://www.drugs.com/lumryz.html,https://www.drugs.com/mtm/sodium-oxybate.html,"Miscellaneous anxiolytics, sedatives and hypnotics",https://www.drugs.com/images/pills/custom/pill34727-1/lumryz.jpeg,,,,,Prescription only,Risk data available,Moderate abuse potential,Drug history at FDA,,,,,
Lyfgenia,lovotibeglogene autotemcel,Suspension for Intravenous Infusion,"December 8, 2023","Bluebird Bio, Inc.",Sickle Cell Disease,https://www.drugs.com/lyfgenia.html,https://www.drugs.com/mtm/lovotibeglogene-autotemcel.html,Miscellaneous uncategorized agents,,"hydroxyurea, vitamin e, Hydrea, Endari, glutamine, Oxbryta",,,,Prescription only,Risk data available,Not a controlled drug,,,,,,
Mydcombi,phenylephrine hydrochloride and tropicamide,Ophthalmic Spray,"May 5, 2023","Eyenovia, Inc.",Pupillary Dilation,https://www.drugs.com/mydcombi.html,https://www.drugs.com/cons/tropicamide-and-phenylephrine.html,Mydriatics,,,,,,Prescription only,,Not a controlled drug,,,,,,
FDA Approves Technegas (Technetium Tc 99-m Labeled Carbon) Radioactive Diagnostic Agent,technetium Tc 99m carbon,Inhalation Aerosol,"September 29, 2023",Cyclopharm Limited,Diagnosis and Investigation,https://www.drugs.com/newdrugs/fda-approves-technegas-technetium-tc-99-m-labeled-carbon-radioactive-diagnostic-agent-6106.html,,,,,,,,Prescription only,,,,,,,,
Ngenla,somatrogon-ghla,Injection,"June 27, 2023",Pfizer Inc.,Pediatric Growth Hormone Deficiency,https://www.drugs.com/ngenla.html,https://www.drugs.com/mtm/somatrogon.html,Growth hormones,https://www.drugs.com/images/pills/custom/pill34695-1/ngenla.jpeg,,,,,Prescription only,Risk data available,Not a controlled drug,Drug history at FDA,Anti-Doping Classification,,,,
Ogsiveo,nirogacestat,Tablets,"November 27, 2023","SpringWorks Therapeutics, Inc.",Desmoid Tumors,https://www.drugs.com/ogsiveo.html,https://www.drugs.com/mtm/nirogacestat.html,Miscellaneous antineoplastics,https://www.drugs.com/images/pills/custom/pill35357-1.webp,nirogacestat,,,,Prescription only,Risk data available,Not a controlled drug,,,,,,
Ojjaara,momelotinib,Tablets,"September 15, 2023",GSK,Myelofibrosis,https://www.drugs.com/ojjaara.html,https://www.drugs.com/mtm/momelotinib.html,Multikinase inhibitors,,"Inrebic, Vonjo, Jakafi, ruxolitinib, momelotinib, pacritinib",,,,Prescription only,Risk data available,Not a controlled drug, FDA approved 2023,,,,,
Omisirge,omidubicel-onlv,Suspension for Infusion,"April 17, 2023",Gamida Cell Ltd.,Stem Cell Therapy,https://www.drugs.com/omisirge.html,https://www.drugs.com/mtm/omidubicel.html,Miscellaneous uncategorized agents,,,,,,Prescription only,Risk data available,Not a controlled drug,,,,,,
Omvoh,mirikizumab-mrkz,Injection,"October 26, 2023",Eli Lilly and Company,Ulcerative Colitis,https://www.drugs.com/omvoh.html,https://www.drugs.com/mtm/mirikizumab.html,Interleukin inhibitors,,,,,,Prescription only,Risk data available,Not a controlled drug, FDA approved 2023,,,,,
Opill,norgestrel,Tablets,"July 13, 2023",Perrigo Company plc,Birth Control,https://www.drugs.com/opill.html,https://www.drugs.com/cons/norgestrel.html,Progestins,https://www.drugs.com/images/pills/custom/pill34773-1/opill.png,,,,,Over the counter,,Not a controlled drug,Drug history at FDA,,,,,
Opvee,nalmefene hydrochloride,Nasal Spray,"May 22, 2023","Opiant Pharmaceuticals, Inc.",Opioid Overdose,https://www.drugs.com/opvee.html,https://www.drugs.com/cons/nalmefene-injection.html,Antidotes,https://www.drugs.com/images/pills/custom/pill34475-1/opvee.jpeg,"naloxone, Narcan, nalmefene, Kloxxado, Evzio",,,,Prescription only,Risk data available,Not a controlled drug,,,,,,
Orserdu,elacestrant,Tablets,"January 27, 2023",Menarini Group,Breast Cancer,https://www.drugs.com/orserdu.html,https://www.drugs.com/mtm/elacestrant.html,Estrogen receptor antagonists,https://www.drugs.com/images/pills/custom/pill33968-1/orserdu.png,,,,,Prescription only,Risk data available,Not a controlled drug, FDA approved 2023,,,,,
