name,molecule,dosage_form,date_of_approval,company,treatment_for,url_x,molecule_url,drug_class,image,related_drugs,rating,reviews,reviews_url,Availability,Pregnancy & Lactation,CSA Schedule*,Approval History,WADA Class,most_reviewed_condition,most_reviewed_rating,n_reviews,url_y
Auvelity,dextromethorphan and bupropion,Extended-Release Tablets  - formerly AXS-05,"August 18, 2022","Axsome Therapeutics, Inc.",Major Depressive Disorder,https://www.drugs.com/auvelity.html,https://www.drugs.com/mtm/bupropion-and-dextromethorphan.html,Miscellaneous antidepressants,https://www.drugs.com/images/pills/custom/pill33440-1/auvelity.png,"Trintellix, Vraylar, sertraline, trazodone, Lexapro, Zoloft, Wellbutrin",8.3,91,https://www.drugs.com/comments/bupropion-dextromethorphan/auvelity.html,Prescription only,Risk data available,Not a controlled drug,Drug history at FDA,,Major Depressive Disorder  ,8.3,86,https://www.drugs.com/comments/bupropion-dextromethorphan/auvelity.html
Quviviq,daridorexant,Tablets,"January 7, 2022",Idorsia Ltd.,Insomnia,https://www.drugs.com/quviviq.html,https://www.drugs.com/mtm/daridorexant.html,"Miscellaneous anxiolytics, sedatives and hypnotics",https://www.drugs.com/images/pills/custom/pill32364-1/quviviq.jpeg,,4.2,121,https://www.drugs.com/comments/daridorexant/quviviq.html,Prescription only,Risk data available,Some potential for abuse, FDA approved 2022,,Insomnia  ,4.2,121,https://www.drugs.com/comments/daridorexant/quviviq.html
Vabysmo,faricimab-svoa,Intravitreal Injection,"January 28, 2022",Genentech,"Macular Degeneration, Diabetic Macular Edema, Macular Edema",https://www.drugs.com/vabysmo.html,https://www.drugs.com/mtm/faricimab-ophthalmic.html,Anti-angiogenic ophthalmic agents,https://www.drugs.com/images/pills/custom/pill34247-1/vabysmo.png,,8.6,15,https://www.drugs.com/comments/faricimab/vabysmo.html,Prescription only,Risk data available,Not a controlled drug,,,Macular Degeneration  ,7.9,10,https://www.drugs.com/comments/faricimab/vabysmo.html
Zoryve,roflumilast,Cream and Foam,"July 29, 2022","Arcutis Biotherapeutics, Inc.","Plaque Psoriasis, Seborrheic Dermatitis",https://www.drugs.com/zoryve.html,https://www.drugs.com/mtm/roflumilast-topical.html,Selective phosphodiesterase-4 inhibitors,https://www.drugs.com/images/pills/custom/pill33377-1/zoryve.jpeg,"Cimzia, Otezla, Stelara, Taltz, Remicade, Humira, Enbrel",8.9,25,https://www.drugs.com/comments/roflumilast-topical/zoryve.html,Prescription only,Risk data available,Not a controlled drug,Drug history at FDA,,Plaque Psoriasis  ,9.0,21,https://www.drugs.com/comments/roflumilast-topical/zoryve.html
Vtama,tapinarof,Cream,"May 23, 2022",Dermavant Sciences,Plaque Psoriasis,https://www.drugs.com/vtama.html,https://www.drugs.com/mtm/tapinarof-topical.html,Topical antipsoriatics,https://www.drugs.com/images/pills/custom/pill32895-1/vtama.jpeg,,7.9,33,https://www.drugs.com/comments/tapinarof-topical/vtama.html,Prescription only,Risk data available,Not a controlled drug, FDA approved 2022,,Plaque Psoriasis  ,8.0,30,https://www.drugs.com/comments/tapinarof-topical/vtama.html
Mounjaro,tirzepatide,Injection,"May 13, 2022",Eli Lilly and Company,"Diabetes, Type 2",https://www.drugs.com/mounjaro.html,https://www.drugs.com/tirzepatide.html,Incretin Mimetics (GLP-1 Agonists),https://www.drugs.com/images/pills/custom/pill32896-1/mounjaro.jpg,"metformin, semaglutide, Trulicity, phentermine, Wegovy, Zepbound, Lantus",8.5,800,https://www.drugs.com/comments/tirzepatide/mounjaro.html,Prescription only,Risk data available,Not a controlled drug,Drug history at FDA,,"Diabetes, Type 2  ",8.2,492,https://www.drugs.com/comments/tirzepatide/mounjaro.html
Adlarity,donepezil,Transdermal System,"March 11, 2022","Corium, Inc.",Alzheimer's Disease,https://www.drugs.com/adlarity.html,https://www.drugs.com/mtm/donepezil.html,Cholinesterase inhibitors,https://www.drugs.com/images/pills/custom/pill34732-1/adlarity.jpeg,"donepezil, memantine, Aricept, Namenda, rivastigmine, Exelon",,,,Prescription only,Risk data available,Not a controlled drug,Drug history at FDA,,,,,
Adstiladrin,nadofaragene firadenovec-vncg,Suspension for Intravesical Use,"December 16, 2022",Ferring Pharmaceuticals,Bladder Cancer,https://www.drugs.com/adstiladrin.html,https://www.drugs.com/mtm/nadofaragene-firadenovec.html,Miscellaneous antineoplastics,,,,,,Prescription only,Risk data available,Not a controlled drug,,,,,,
Amvuttra,vutrisiran,Injection,"June 13, 2022","Alnylam Pharmaceuticals, Inc.",Hereditary Amyloidosis,https://www.drugs.com/amvuttra.html,https://www.drugs.com/mtm/vutrisiran.html,Miscellaneous metabolic agents,https://www.drugs.com/images/pills/custom/pill33080-1.webp,"tafamidis, eplontersen, patisiran, vutrisiran, inotersen",,,,Prescription only,Risk data available,Not a controlled drug, FDA approved 2022,,,,,
Briumvi,ublituximab-xiiy,Injection,"December 28, 2022","TG Therapeutics, Inc.",Multiple Sclerosis,https://www.drugs.com/briumvi.html,https://www.drugs.com/mtm/ublituximab.html,CD20 monoclonal antibodies,https://www.drugs.com/images/pills/custom/pill34081-1.webp,"Ocrevus, Tecfidera, Rebif, Betaseron, Extavia, Vumerity, Mavenclad",,,,Prescription only,Risk data available,Not a controlled drug, FDA approved 2022,,,,,
Camzyos,mavacamten,Capsules,"April 28, 2022",Bristol Myers Squibb,Hypertrophic Cardiomyopathy,https://www.drugs.com/camzyos.html,https://www.drugs.com/mtm/mavacamten.html,Miscellaneous cardiovascular agents,https://www.drugs.com/images/pills/custom/pill33015-1/camzyos.jpeg,mavacamten,,,,Prescription only,Risk data available,Not a controlled drug, FDA approved 2022,,,,,
Carvykti,ciltacabtagene autoleucel,Suspension for Intravenous Infusion,"February 28, 2022",Janssen Pharmaceutical Companies,Multiple Myeloma,https://www.drugs.com/carvykti.html,https://www.drugs.com/mtm/ciltacabtagene-autoleucel.html,Miscellaneous antineoplastics,https://www.drugs.com/images/pills/custom/pill33492-1/carvykti.jpeg,"Abecma, Velcade, Revlimid, Darzalex, Pomalyst, Kyprolis, Ninlaro",,,,Prescription only,Risk data available,Not a controlled drug,,,,,,
Cibinqo,abrocitinib,Tablets,"January 14, 2022",Pfizer Inc.,Atopic Dermatitis,https://www.drugs.com/cibinqo.html,https://www.drugs.com/mtm/abrocitinib.html,Selective immunosuppressants,https://www.drugs.com/images/pills/custom/pill32413-1.webp,,,,,Prescription only,Risk data available,Not a controlled drug, FDA approved 2022,,,,,
Cimerli,ranibizumab-eqrn,Intravitreal Injection,"August 2, 2022","Coherus BioSciences, Inc.","Macular Degeneration, Macular Edema, Diabetic Macular Edema, Diabetic Retinopathy, Myopic Choroidal Neovascularization",https://www.drugs.com/cimerli.html,https://www.drugs.com/mtm/ranibizumab-ophthalmic.html,Anti-angiogenic ophthalmic agents,https://www.drugs.com/images/pills/custom/pill33486-1/cimerli.jpeg,"triamcinolone ophthalmic, dexamethasone ophthalmic, Eylea, Vabysmo, Izervay, fluocinolone ophthalmic, Lucentis",,,,Prescription only,Risk data available,Not a controlled drug,,,,,,
Radicava ORS,edaravone,Oral Suspension,"May 12, 2022",Mitsubishi Tanabe Pharma Corporation,Amyotrophic Lateral Sclerosis,https://www.drugs.com/cons/radicava-ors.html,https://www.drugs.com/mtm/edaravone-oral-injection.html,Miscellaneous central nervous system agents,https://www.drugs.com/images/pills/custom/pill32816-1/radicava-ors.jpeg,,,,,Prescription only,Risk data available,Not a controlled drug,Drug history at FDA,,,,,
Daxxify,daxibotulinumtoxinA-lanm,Lyophilized Powder for Injection,"September 7, 2022","Revance Therapeutics, Inc.","Glabellar Lines, Cervical Dystonia",https://www.drugs.com/daxxify.html,https://www.drugs.com/mtm/daxibotulinumtoxina.html,Skeletal muscle relaxants,https://www.drugs.com/images/pills/custom/pill33494-1/daxxify.jpeg,"Botox, onabotulinumtoxinA, Xeomin, Dysport, Botox Cosmetic, rimabotulinumtoxinB, Jeuveau",,,,Prescription only,Risk data available,Not a controlled drug, FDA approved 2022,,,,,
Elahere,mirvetuximab soravtansine-gynx,Injection,"November 14, 2022","ImmunoGen, Inc.","Ovarian Cancer, Fallopian Tube Cancer, Peritoneal Cancer",https://www.drugs.com/elahere.html,https://www.drugs.com/mtm/mirvetuximab-soravtansine.html,Miscellaneous antineoplastics,https://www.drugs.com/images/pills/custom/pill33730-1/elahere.jpeg,,,,,Prescription only,Risk data available,Not a controlled drug, FDA approved 2022,,,,,
Enjaymo,sutimlimab-jome,Injection,"February 4, 2022",Sanofi,Cold Agglutinin Disease,https://www.drugs.com/enjaymo.html,https://www.drugs.com/mtm/sutimlimab.html,Selective immunosuppressants,https://www.drugs.com/images/pills/custom/pill34246-1/enjaymo.jpeg,sutimlimab,,,,Prescription only,Risk data available,Not a controlled drug, FDA approved 2022,,,,,
Epsolay,benzoyl peroxide,Cream,"April 22, 2022","Sol-Gel Technologies, Ltd.",Rosacea,https://www.drugs.com/epsolay.html,https://www.drugs.com/mtm/benzoyl-peroxide-topical.html,,https://www.drugs.com/images/pills/custom/pill33081-1/epsolay.png,"doxycycline, metronidazole topical, ivermectin topical, minocycline topical, brimonidine topical, oxymetazoline topical",,,,Prescription only,Risk data available,Not a controlled drug,Drug history at FDA,,,,,
Furoscix,furosemide,Injection,"October 7, 2022","scPharmaceuticals, Inc.",Heart Failure,https://www.drugs.com/furoscix.html,https://www.drugs.com/furosemide.html,,https://www.drugs.com/images/pills/custom/pill33672-1/furoscix.jpeg,,,,,Prescription only,Risk data available,Not a controlled drug,Drug history at FDA,Anti-Doping Classification,,,,
Hemgenix,etranacogene dezaparvovec-drlb,Suspension for Intravenous Infusion,"November 22, 2022",CSL,Hemophilia B,https://www.drugs.com/hemgenix.html,https://www.drugs.com/mtm/etranacogene-dezaparvovec.html,Miscellaneous uncategorized agents,https://www.drugs.com/images/pills/custom/pill34730-1/hemgenix.jpeg,"BeneFix, Idelvion, coagulation factor ix, Alprolix, Ixinity, NovoSeven RT",,,,Prescription only,Risk data available,Not a controlled drug,,,,,,
Iyuzeh,latanoprost,Ophthalmic Solution,"December 13, 2022","Thea Pharma, Inc.","Intraocular Hypertension, Glaucoma, Open Angle",https://www.drugs.com/history/iyuzeh.html,https://www.drugs.com/condition/intraocular-hypertension.html,"Glaucoma, Open Angle",,,,,,Prescription only,Risk data available,Not a controlled drug,Drug history at FDA,,,,,
Hyftor,sirolimus,Topical Gel,"March 22, 2022","Nobelpharma America, LLC",Facial Angiofibroma Associated with Tuberous Sclerosis,https://www.drugs.com/hyftor.html,https://www.drugs.com/mtm/sirolimus-topical.html,MTOR inhibitors,https://www.drugs.com/images/pills/custom/pill33490-1/hyftor.jpeg,"cannabidiol, sirolimus topical, everolimus, Epidiolex, Afinitor, Afinitor Disperz",,,,Prescription only,Risk data available,Not a controlled drug,Drug history at FDA,,,,,
Imjudo,tremelimumab-actl,Injection,"October 21, 2022",AstraZeneca,"Hepatocellular Carcinoma, Non-Small Cell Lung Cancer",https://www.drugs.com/imjudo.html,https://www.drugs.com/mtm/tremelimumab.html,Anti-CTLA-4 monoclonal antibodies,https://www.drugs.com/images/pills/custom/pill33673-1/imjudo.jpeg,"Opdivo, methotrexate, Keytruda, Avastin, pembrolizumab, bevacizumab, nivolumab",,,,Prescription only,Risk data available,Not a controlled drug, FDA approved 2022,,,,,
Kimmtrak,tebentafusp-tebn,Injection,"January 25, 2022",Immunocore,Uveal Melanoma,https://www.drugs.com/kimmtrak.html,https://www.drugs.com/mtm/tebentafusp.html,Miscellaneous antineoplastics,https://www.drugs.com/images/pills/custom/pill34248-1/kimmtrak.png,,,,,Prescription only,Risk data available,Not a controlled drug, FDA approved 2022,,,,,
Krazati,adagrasib,Tablets,"December 12, 2022","Mirati Therapeutics, Inc.",Non-Small Cell Lung Cancer,https://www.drugs.com/krazati.html,https://www.drugs.com/mtm/adagrasib.html,Miscellaneous antineoplastics,https://www.drugs.com/images/pills/custom/pill33822-1/krazati.png,"Opdivo, methotrexate, Keytruda, Avastin, pembrolizumab, bevacizumab, Tagrisso",,,,Prescription only,Risk data available,Not a controlled drug, FDA approved 2022,,,,,
Kyzatrex,testosterone undecanoate,Capsules,"July 27, 2022",Marius Pharmaceuticals,"Hypogonadism, Male",https://www.drugs.com/kyzatrex.html,https://www.drugs.com/testosterone.html,Androgens and anabolic steroids,https://www.drugs.com/images/pills/custom/pill33393-1/kyzatrex.jpeg,"testosterone, AndroGel, Xyosted, Depo-Testosterone, Pregnyl, HCG",,,,Prescription only,Risk data available,Moderate abuse potential,Drug history at FDA,Anti-Doping Classification,,,,
Lunsumio,mosunetuzumab-axgb,Injection,"December 22, 2022",Genentech,Follicular Lymphoma,https://www.drugs.com/lunsumio.html,https://www.drugs.com/mtm/mosunetuzumab.html,Miscellaneous antineoplastics,https://www.drugs.com/images/pills/custom/pill34079-1/lunsumio.jpeg,"Rituxan, Truxima, Yescarta, Monjuvi, Kymriah, Polivy, Tazverik",,,,Prescription only,Risk data available,Not a controlled drug, FDA approved 2022,,,,,
Lytgobi,futibatinib,Tablets,"September 30, 2022","Taiho Oncology, Inc.",Cholangiocarcinoma,https://www.drugs.com/lytgobi.html,https://www.drugs.com/mtm/futibatinib.html,Multikinase inhibitors,,,,,,Prescription only,Risk data available,Not a controlled drug,Drug history at FDA,,,,,
Alymsys,bevacizumab-maly,Injection,"April 13, 2022","Amneal Pharmaceuticals, Inc.","Colorectal Cancer, Non-Small Cell Lung Cancer, Glioblastoma Multiforme, Renal Cell Carcinoma, Cervical Cancer, Ovarian Cancer, Fallopian Tube Cancer, Peritoneal Cancer",https://www.drugs.com/mtm/alymsys.html,https://www.drugs.com/bevacizumab.html,Avastin,https://www.drugs.com/images/pills/custom/pill33082-1/alymsys.jpeg,,,,,Prescription only,Risk data available,Not a controlled drug,Drug history at FDA,,,,,
Fleqsuvy,baclofen,Oral Suspension,"February 4, 2022","Azurity Pharmaceuticals, Inc.",Spasticity,https://www.drugs.com/mtm/fleqsuvy.html,https://www.drugs.com/baclofen.html,Lyvispah,https://www.drugs.com/images/pills/custom/pill34245-1/fleqsuvy.png,"cyclobenzaprine, methocarbamol, baclofen, tizanidine, diazepam, Botox, Soma",,,,Prescription only,Risk data available,Not a controlled drug,Drug history at FDA,,,,,
Fylnetra,pegfilgrastim-pbbk,Injection,"May 26, 2022","Amneal Pharmaceuticals, Inc.",Neutropenia Associated with Chemotherapy,https://www.drugs.com/mtm/fylnetra.html,https://www.drugs.com/pegfilgrastim.html,Fulphila,https://www.drugs.com/images/pills/custom/pill34236-1/fylnetra.png,"Neulasta, filgrastim, Zarxio, Neupogen, Rolvedon, Granix",,,,Prescription only,Risk data available,Not a controlled drug,Drug history at FDA,,,,,
Idacio,adalimumab-aacf,Injection,"December 13, 2022",Fresenius Kabi,"Rheumatoid Arthritis, Juvenile Idiopathic Arthritis, Psoriatic Arthritis, Ankylosing Spondylitis, Crohn's Disease, Ulcerative Colitis, Plaque Psoriasis, Hidradenitis Suppurativa, Uveitis",https://www.drugs.com/mtm/idacio-pen.html,https://www.drugs.com/adalimumab.html,TNF alfa inhibitors,,"Entyvio, Cimzia, Otezla, Stelara, Taltz, Lialda, Remicade",,,,Prescription only,Risk data available,Not a controlled drug,Drug history at FDA,,,,,
Igalmi,dexmedetomidine,Sublingual Film,"April 5, 2022","BioXcel Therapeutics, Inc.",Agitation,https://www.drugs.com/mtm/igalmi-buccal-sublingual.html,https://www.drugs.com/mtm/dexmedetomidine-buccal-sublingual.html,"Miscellaneous anxiolytics, sedatives and hypnotics",https://www.drugs.com/images/pills/custom/pill33084-1/igalmi.png,"olanzapine, dexmedetomidine, loxapine, Zyprexa Intramuscular, amitriptyline / perphenazine",,,,Prescription only,Risk data available,Not a controlled drug,Drug history at FDA,,,,,
Terlivaz,terlipressin,Lyophilized Powder for Injection,"September 14, 2022",Mallinckrodt plc,Hepatorenal Syndrome,https://www.drugs.com/mtm/terlivaz.html,https://www.drugs.com/mtm/terlipressin.html,Antidiuretic hormones,https://www.drugs.com/images/pills/custom/pill33733-1/terlivaz.jpeg,,,,,Prescription only,Risk data available,Not a controlled drug,Drug history at FDA,,,,,
Nasonex 24HR Allergy,mometasone furoate monohydrate,Nasal Spray,"March 17, 2022",Perrigo Company plc,Allergic Rhinitis,https://www.drugs.com/nasonex.html,https://www.drugs.com/mtm/mometasone-nasal.html,Nasal steroids,https://www.drugs.com/images/pills/custom/pill33491-1/nasonex-24hr-allergy.png,,,,,Over the counter,Risk data available,Not a controlled drug,,Anti-Doping Classification,,,,
Omlonti,omidenepag isopropyl,Ophthalmic Solution,"September 22, 2022",Santen Inc.,Glaucoma/Intraocular Hypertension,https://www.drugs.com/omlonti.html,https://www.drugs.com/cons/omidenepag-isopropyl.html,Ophthalmic glaucoma agents,https://www.drugs.com/images/pills/custom/pill33619-1/omlonti.jpeg,,,,,Prescription only,Risk data available,Not a controlled drug, FDA approved 2022,,,,,
Opdualag,nivolumab and relatlimab-rmbw,Injection,"March 18, 2022",Bristol Myers Squibb,Melanoma,https://www.drugs.com/opdualag.html,https://www.drugs.com/mtm/nivolumab-and-relatlimab.html,Antineoplastic combinations,https://www.drugs.com/images/pills/custom/pill33086-1.webp,,,,,Prescription only,Risk data available,Not a controlled drug,,,,,,
Pedmark,sodium thiosulfate,Injection,"September 20, 2022",Fennec Pharmaceuticals Inc.,Prevention of Cisplatin-Induced Ototoxicity,https://www.drugs.com/pedmark.html,https://www.drugs.com/cons/sodium-thiosulfate.html,Antineoplastic detoxifying agents,https://www.drugs.com/images/pills/custom/pill34235-1/pedmark.jpeg,,,,,Prescription only,Risk data available,Not a controlled drug,Drug history at FDA,,,,,
Pluvicto,lutetium lu 177 vipivotide tetraxetan,Injection,"March 23, 2022",Novartis,Prostate Cancer,https://www.drugs.com/pluvicto.html,https://www.drugs.com/cons/lutetium-lu-177-vipivotide-tetraxetan.html,Therapeutic radiopharmaceuticals,https://www.drugs.com/images/pills/custom/pill32902-1/pluvicto.jpeg,,,,,Prescription only,Risk data available,Not a controlled drug, FDA approved 2022,,,,,
Aponvie,aprepitant,Injection  - formerly HTX-019,"September 16, 2022","Heron Therapeutics, Inc.","Nausea/Vomiting, Postoperative",https://www.drugs.com/pro/aponvie.html,https://www.drugs.com/mtm/aprepitant.html,NK1 receptor antagonists,https://www.drugs.com/images/pills/custom/pill33732-1/aponvie.png,"ondansetron, hydroxyzine, lorazepam, dexamethasone, olanzapine, Zofran, promethazine",,,,Prescription only,Risk data available,Not a controlled drug,Drug history at FDA,,,,,
Bludigo,indigotindisulfonate sodium,Injection,"July 8, 2022",Provepharm,Diagnosis and Investigation,https://www.drugs.com/pro/bludigo-injection.html,https://www.drugs.com/drug-class/miscellaneous-diagnostic-dyes.html,,https://www.drugs.com/images/pills/custom/pill35064-1/bludigo.png,,,,,Prescription only,,Not a controlled drug,,,,,,
Cuvrior,trientine tetrahydrochloride,Tablets,"April 28, 2022",Orphalan SA,Wilson's Disease,https://www.drugs.com/pro/cuvrior.html,https://www.drugs.com/mtm/trientine.html,Chelating agents,,"penicillamine, zinc acetate, Galzin, trientine, Cuprimine, Clovique",,,,Prescription only,Risk data available,Not a controlled drug,Drug history at FDA,,,,,
Elucirem,gadopiclenol,Injection,"September 21, 2022",Guerbet,Diagnosis and Investigation,https://www.drugs.com/pro/elucirem.html,https://www.drugs.com/cons/gadopiclenol.html,Magnetic resonance imaging contrast media,,,,,,Prescription only,Risk data available,Not a controlled drug,Drug history at FDA,,,,,
Iheezo,chloroprocaine hydrochloride,Ophthalmic Gel,"September 27, 2022",Harrow,Ocular Surface Anesthesia,https://www.drugs.com/pro/iheezo-ophthalmic-gel.html,https://www.drugs.com/mtm/chloroprocaine-ophthalmic.html,Ophthalmic anesthetics,https://www.drugs.com/images/pills/custom/pill33620-1/iheezo.jpeg,,,,,Prescription only,Risk data available,Not a controlled drug,Drug history at FDA,,,,,
Konvomep,omeprazole and sodium bicarbonate,Powder for Oral Suspension,"August 30, 2022","Azurity Pharmaceuticals, Inc.","Stomach Ulcer, Gastrointestinal Hemorrhage",https://www.drugs.com/pro/konvomep.html,https://www.drugs.com/mtm/omeprazole-and-sodium-bicarbonate.html,Proton pump inhibitors,https://www.drugs.com/images/pills/custom/pill34731-1/konvomep.jpeg,,,,,Rx and/or OTC,Risk data available,Not a controlled drug,Drug history at FDA,,,,,
Locametz,gallium Ga 68 gozetotide,Injection,"March 23, 2022",Novartis Pharmaceuticals Corporation,Positron Emission Tomography Imaging,https://www.drugs.com/pro/locametz.html,https://www.drugs.com/drug-class/radiologic-conjugating-agents.html,,https://www.drugs.com/images/pills/custom/pill33489-1/locametz.jpeg,,,,,Prescription only,Risk data available,Not a controlled drug,,,,,,
NephroScan,technetium Tc 99m succimer,Injection Kit,"February 22, 2022",,Diagnosis and Investigation,https://www.drugs.com/pro/nephroscan.html,https://www.drugs.com/mtm/succimer.html,,,,,,,Prescription only,Risk data available,Not a controlled drug,,,,,,
NexoBrid,anacaulase-bcdb,for Topical Gel,"December 28, 2022",MediWound Ltd.,Thermal Burn,https://www.drugs.com/pro/nexobrid.html,https://www.drugs.com/cons/anacaulase-bcdb.html,Topical debriding agents,https://www.drugs.com/images/pills/custom/pill34232-1/nexobrid.png,,,,,Prescription only,Risk data available,Not a controlled drug,Drug history at FDA,,,,,
Norliqva,amlodipine besylate,Oral Solution,"February 24, 2022","CMP Pharma, Inc.","High Blood Pressure, Coronary Artery Disease, Angina",https://www.drugs.com/pro/norliqva.html,https://www.drugs.com/amlodipine.html,Calcium channel blocking agents,https://www.drugs.com/images/pills/custom/pill34244-1/norliqva.png,,,,,Prescription only,Risk data available,Not a controlled drug,Drug history at FDA,,,,,
Olpruva,sodium phenylbutyrate,for Oral Suspension  - formerly ACER-001,"December 22, 2022",Acer Therapeutics Inc.,Urea Cycle Disorders,https://www.drugs.com/pro/olpruva.html,https://www.drugs.com/mtm/sodium-phenylbutyrate.html,Urea cycle disorder agents,,"Ravicti, sodium phenylbutyrate, glycerol phenylbutyrate, Buphenyl, Pheburane",,,,Prescription only,Risk data available,Not a controlled drug,Drug history at FDA,,,,,
Priorix,"measles, mumps, and rubella virus vaccine, live",Injection,"June 3, 2022",GSK,"Measles Prophylaxis, Mumps Prophylaxis, Rubella Prophylaxis",https://www.drugs.com/pro/priorix.html,https://www.drugs.com/mtm/measles-mumps-and-rubella-mmr-vaccine.html,Vaccine combinations,https://www.drugs.com/images/pills/custom/pill33079-1/priorix.png,,,,,Prescription only,Risk data available,Not a controlled drug,,,,,,
Releuko,filgrastim-ayow,Injection,"February 25, 2022","Kashiv BioSciences, LLC","Neutropenia Associated with Chemotherapy, Neutropenia",https://www.drugs.com/pro/releuko.html,https://www.drugs.com/mtm/filgrastim.html,Colony stimulating factors,https://www.drugs.com/images/pills/custom/pill34240-1/releuko.png,"fluconazole, Diflucan, cisplatin, Neulasta, filgrastim, Zarxio, Neupogen",,,,Prescription only,Risk data available,Not a controlled drug,Drug history at FDA,,,,,
Sezaby,phenobarbital sodium,Powder for Injection,"November 17, 2022",Sun Pharmaceutical Industries Limited,Neonatal Seizures,https://www.drugs.com/pro/sezaby-injection.html,https://www.drugs.com/mtm/phenobarbital.html,Barbiturate anticonvulsants,,,,,,Prescription only,Risk data available,Some potential for abuse,Drug history at FDA,,,,,
Stimufend,pegfilgrastim-fpgk,Injection,"September 1, 2022",Fresenius Kabi,"Neutropenia Associated with Chemotherapy, Neutropenia Associated with Radiation",https://www.drugs.com/pro/stimufend.html,https://www.drugs.com/pegfilgrastim.html,Colony stimulating factors,https://www.drugs.com/images/pills/custom/pill33483-1/stimufend.jpeg,"Neulasta, filgrastim, Zarxio, Neupogen, Rolvedon, pegfilgrastim, Udenyca",,,,Prescription only,Risk data available,Not a controlled drug,Drug history at FDA,,,,,
Vegzelma,bevacizumab-adcd,Injection,"September 27, 2022",Celltrion USA,"Colorectal Cancer, Non-Small Cell Lung Cancer, Glioblastoma Multiforme, Renal Cell Carcinoma, Cervical Cancer, Ovarian Cancer, Fallopian Tube Cancer, Peritoneal Cancer",https://www.drugs.com/pro/vegzelma.html,https://www.drugs.com/bevacizumab.html,VEGF/VEGFR  inhibitors,https://www.drugs.com/images/pills/custom/pill33623-1/vegzelma.jpeg,,,,,Prescription only,Risk data available,Not a controlled drug,Drug history at FDA,,,,,
Xenoview,xenon Xe 129 hyperpolarized,for Oral Inhalation,"December 23, 2022",Polarean Imaging plc,"Diagnosis and Investigation, Imaging of Lung",https://www.drugs.com/pro/xenoview.html,https://www.drugs.com/cons/xenon-xe-129-hyperpolarized.html,Diagnostic radiopharmaceuticals,,"glucagon, Lexiscan, mannitol, arginine, Ceretec",,,,Prescription only,Risk data available,Not a controlled drug,,,,,,
Pyrukynd,mitapivat,Tablets,"February 17, 2022","Agios Pharmaceuticals, Inc.",Pyruvate Kinase Deficiency,https://www.drugs.com/pyrukynd.html,https://www.drugs.com/mtm/mitapivat.html,Miscellaneous metabolic agents,https://www.drugs.com/images/pills/custom/pill32543-1/pyrukynd.jpeg,,,,,Prescription only,Risk data available,Not a controlled drug, FDA approved 2022,,,,,
Rebyota,"fecal microbiota, live-jslm",Suspension for Rectal Use  - formerly RBX2660,"November 30, 2022",Ferring Pharmaceuticals Inc.,Prevention of Recurrent Clostridioides difficile Infection,https://www.drugs.com/rebyota.html,https://www.drugs.com/cons/fecal-microbiota-live-jslm.html,Miscellaneous uncategorized agents,https://www.drugs.com/images/pills/custom/pill34078-2/rebyota.png,,,,,Prescription only,Risk data available,Not a controlled drug,,,,,,
Relyvrio,sodium phenylbutyrate and taurursodiol,Powder for Oral Suspension  - formerly AMX0035,"September 29, 2022","Amylyx Pharmaceuticals, Inc.",Amyotrophic Lateral Sclerosis,https://www.drugs.com/relyvrio.html,https://www.drugs.com/mtm/sodium-phenylbutyrate-and-taurursodiol.html,Miscellaneous central nervous system agents,https://www.drugs.com/images/pills/custom/pill33621-1/relyvrio.jpeg,"riluzole, Radicava, edaravone, sodium phenylbutyrate / taurursodiol, tofersen, Rilutek",,,,Discontinued,Risk data available,Not a controlled drug,Drug history at FDA,,,,,
